HW1_ImageEnhancement/results/metrics/metrics.csv

Image,Method,MSE,PSNR (dB)
MonzaGP.jpeg,Baseline,1794.2195,15.59
MonzaGP.jpeg,Linear Stretching,458.0962,21.52
MonzaGP.jpeg,Histogram Equalization CIE Lab,602.2585,20.33
MonzaGP.jpeg,Histogram Equalization HSV,462.1481,21.48
MonzaGP.jpeg,Bilateral + Stretch,261.7122,23.95
Oceanografic.jpeg,Baseline,1654.1890,15.94
Oceanografic.jpeg,Linear Stretching,1259.5073,17.13
Oceanografic.jpeg,Histogram Equalization CIE Lab,4625.5273,11.48
Oceanografic.jpeg,Histogram Equalization HSV,2260.4016,14.59
Oceanografic.jpeg,Bilateral + Stretch,1913.0543,15.31
Barcelona.jpeg,Baseline,4215.7310,11.88
Barcelona.jpeg,Linear Stretching,693.4457,19.72
Barcelona.jpeg,Histogram Equalization CIE Lab,4183.7090,11.92
Barcelona.jpeg,Histogram Equalization HSV,5391.3218,10.81
Barcelona.jpeg,Bilateral + Stretch,437.5177,21.72
Champions.jpeg,Baseline,2056.4563,15.00
Champions.jpeg,Linear Stretching,794.5435,19.13
Champions.jpeg,Histogram Equalization CIE Lab,1669.1425,15.91
Champions.jpeg,Histogram Equalization HSV,460.0134,21.50
Champions.jpeg,Bilateral + Stretch,382.3455,22.31

HW1_ImageEnhancement/report/Report HW1 - Image Enhancement.md

# Discussion

**Case 1: Oceanografic (The Shark)**
In this case the Histogram Equalization reaches the worst numerical result (PSNR=11.48dB and MSE=4625.5273), far below the Baseline. 
The underwater scene is dominated by the blue spectrum; Histogram Equalization aggressively spreads these intensities, changing the color distribution and amplifying the Gaussian noise. Qualitatively Histogram Equalization is the only method that clearly reveals the silhouette of the shark and the surface light patterns. Conversely, Bilateral + Stretch achieves a higher PSNR (15.31 dB) and a cleaner image, but over-smooths the underwater details. This demonstrates that a higher PSNR does not always correspond to better visual informativeness.

**Case 2: Barcelona (Panorama) - Why HE Fails on Broad Dynamic Ranges**
Histogram Equalization achieves a PSNR almost identical to the Baseline (11.92 dB vs. 11.88 dB). Since the image already contains a broad dynamic range, Histogram Equalizationlacks dominant intensity peaks to redistribute. Instead, it flattens the sky and darken the foliage. Linear Stretching (PSNR = 19.72 dB) performs significantly better, and Bilateral + Stretch achieves the best numerical (21.48 dB) and visual results, removing the noise from the trees while restoring a natural sky gradient.